{
  "branch_ownership": {"classification": "STALE_REMOTE_TRACKING_REF", "historical_closed_or_merged_prs_for_branch": [612, 613], "live_remote_branch_exists": false, "live_remote_branch_sha": null, "local_branch": "issue-608-reviewer-ui-regression-contracts", "open_prs_for_branch": [], "prs_for_exact_current_head": [], "stale_local_remote_tracking_ref_exists": true, "stale_local_remote_tracking_ref_sha": "1111111111111111111111111111111111111111"},
  "changed_files": {"branch_diff": [], "ignored_risk_paths": [], "staged": [], "unstaged": [], "untracked": []},
  "checks": {"applicable_head_sha": null, "records": [], "required_names": ["validate", "docs-check", "fixtures", "security"], "status": "not_applicable_no_current_pr"},
  "classifications": {"findings": [{"affected_identifier": "issue-608-reviewer-ui-regression-contracts", "classification": "INFORMATIONAL_DISCREPANCY", "code": "HISTORICAL_BRANCH_REUSE", "evidence": {"current_head_sha": "2222222222222222222222222222222222222222", "pr_numbers": [612, 613]}, "may_continue": true, "message": "Historical PRs use this branch name at different head SHAs.", "recovery_or_required_authority": "Record historical evidence and continue with current-head ownership checks.", "source": "github"}, {"affected_identifier": "issue-608-reviewer-ui-regression-contracts", "classification": "INFORMATIONAL_DISCREPANCY", "code": "STALE_REMOTE_TRACKING_REF", "evidence": {"tracking_sha": "1111111111111111111111111111111111111111"}, "may_continue": true, "message": "A local remote-tracking ref remains although the live GitHub branch is absent.", "recovery_or_required_authority": "Use the live GitHub ref as authoritative; do not clean up as a side effect.", "source": "local_git+github"}]},
  "freshness": {"collection_finished_at": "2026-07-25T00:00:00Z", "collection_started_at": "2026-07-25T00:00:00Z", "expected_vs_observed": {"branch_matches": true, "head_sha_matches": true, "main_sha_matches": true, "pr_matches": true, "repository": "nicho1ab/RecordsTracker"}, "globally_atomic": false, "stale": false},
  "generated_at": "2026-07-25T00:00:00Z",
  "git": {"authoritative_main_branch": "main", "base_sha": "3333333333333333333333333333333333333333", "current_branch": "issue-608-reviewer-ui-regression-contracts", "current_head_sha": "2222222222222222222222222222222222222222", "dirty": false, "expected_main_sha": "3333333333333333333333333333333333333333", "live_remote_main_sha": "3333333333333333333333333333333333333333", "local_main_sha": "3333333333333333333333333333333333333333", "remote_tracking_main_sha": "3333333333333333333333333333333333333333", "staged": false, "unstaged": false, "untracked": false},
  "issue": {"number": 608, "observed_at": "2026-07-25T00:00:00Z", "state": "open", "title": "Sanitized delivery-state fixture"},
  "next_legal_states": ["READ_ONLY_INSPECTION", "IMPLEMENTATION_WITH_SEPARATE_AUTHORIZATION"],
  "prohibited_actions": ["branch_or_worktree_mutation", "staging", "commit", "push", "pr_or_issue_mutation", "check_rerun", "merge", "deployment", "production_data_mutation", "stash_mutation"],
  "pull_request": null,
  "repository": {"canonical_identity": "nicho1ab/RecordsTracker", "name": "RecordsTracker", "owner": "nicho1ab", "remote_url_classification": "github_https"},
  "schema_version": "recordstracker.delivery-state.v1",
  "sources": ["local_git", "github_api"],
  "stash_protections": {"contents_inspected": false, "expected_identifiers": ["4444444444444444444444444444444444444444"], "observed_identifiers": ["4444444444444444444444444444444444444444"], "observed_presence": true},
  "worktrees": [{"branch": "issue-608-reviewer-ui-regression-contracts", "classification": "retained", "clean": true, "head_sha": "2222222222222222222222222222222222222222", "path": "C:/sanitized/RecordsTracker-issue-608"}]
}
